{
  "schema_version": "1.0.0",
  "seed_set_id": "seeds_demo_reporter",
  "target_protein": "MKRIL*",
  "target_protein_digest": "sha256:9876543210fedcba9876543210fedcba9876543210fedcba9876543210fedcba",
  "translation_table": 11,
  "host_id": "escherichia_coli:562/K-12_MG1655",
  "seeds": [
    {
      "seed_id": "sd_lineardesign_lambda0",
      "cds": "ATGAAACGCATCCTGTAA",
      "digest": "sha256:00ff00ff00ff00ff00ff00ff00ff00ff00ff00ff00ff00ff00ff00ff00ff00ff",
      "source": {
        "tool": "lineardesign",
        "version": "1.0",
        "parameters": { "lambda": 0.0, "beam": 100 },
        "uri": "file://seeds/ld_lambda0.fasta",
        "imported_at": "2026-08-25T07:40:00Z"
      },
      "reported_metrics": { "cai": 0.84, "mfe_kcal_per_mol": -2.1 },
      "acceptance": { "accepted": true, "reason": "ok", "protein_diff": [], "repaired": false, "n_repair_edits": 0 }
    },
    {
      "seed_id": "sd_codontransformer_default",
      "cds": "ATGAAACGTATTTTGTAA",
      "digest": "sha256:112233445566778f112233445566778f112233445566778f112233445566778f",
      "source": {
        "tool": "codontransformer",
        "version": "0.2.1",
        "parameters": { "organism": "Escherichia coli general", "deterministic": true },
        "uri": null,
        "imported_at": "2026-08-25T07:41:00Z"
      },
      "reported_metrics": {},
      "acceptance": { "accepted": true, "reason": "ok", "protein_diff": [], "repaired": true, "n_repair_edits": 1 }
    },
    {
      "seed_id": "sd_user_paste_wrong_gene",
      "cds": "ATGAAACATATTCTGTAA",
      "digest": "sha256:cafebabedeadbeefcafebabedeadbeefcafebabedeadbeefcafebabedeadbeef",
      "source": { "tool": "manual", "version": null, "parameters": {}, "uri": null, "imported_at": "2026-08-25T07:42:00Z" },
      "reported_metrics": {},
      "acceptance": {
        "accepted": false,
        "reason": "protein_mismatch",
        "protein_diff": [{ "position": 2, "expected": "R", "found": "H" }],
        "repaired": false,
        "n_repair_edits": 0
      }
    }
  ],
  "injection_policy": {
    "max_fraction_of_population": 0.2,
    "deduplicate": true,
    "repair_before_inject": true,
    "also_inject_mutated_copies": true,
    "protect_for_generations": 0
  },
  "digest": "sha256:abcdefabcdefabcdabcdefabcdefabcdabcdefabcdefabcdabcdefabcdefabcd"
}
